id,title,year,language,Nb_authors,Nb_male,Nb_female,theme,keywords
225,Une méthode supervisée pour initialiser les centres des K-moyennes,2016,fr,3,3,3,Apprentissage,pas encore
226,Vers une approche Visual Analytics pour explorer les variantes de sujets d'un corpus,2016,fr,3,3,3,Apprentissage,pas encore
227,Visualisation interactive de métadonnées pour aider les utilisateurs d'un logiciel de cartographie statistique à concevoir de meilleures cartes.,2016,fr,1,1,1,Apprentissage,pas encore
230,Analyse des paramètres de recherche d'information: Etude de l'influence des paramètres sur les résultats,2015,fr,2,2,2,Apprentissage,pas encore
231,Analyse et visualisation d'opinions dans un cadre de veille sur leWeb,2015,fr,5,5,5,Apprentissage,pas encore
232,Analyse OLAP sur des tweets et des blogs : un retour d'expérience,2015,fr,3,3,3,Apprentissage,pas encore
233,Analyse visuelle pour la détection des intrusions,2015,fr,2,2,2,Apprentissage,pas encore
234,Approche d'extraction de classes interlangues à partir de documents multilingues à base de Concepts Fermés,2015,fr,2,2,2,Règles,pas encore
235,Approche relationnelle de l'apprentissage de séquences,2015,fr,3,3,3,Spatio-temporel,pas encore
239,Choix d'une mesure de proximité discriminante dans un contexte topologique,2015,fr,2,2,2,Apprentissage,pas encore
240,Classification évidentielle avec contraintes d'étiquettes,2015,fr,2,2,2,Images,pas encore
241,Classification multi-label par raisonnement logique pour l'indexation sémantique de documents,2015,fr,3,3,3,Visualisation,pas encore
242,Clustering topologique pour le flux de données,2015,fr,3,3,3,Motifs,pas encore
243,Cohérence des données de bases RDF en évolution constante,2015,fr,3,3,3,Motifs,pas encore
245,Compromis précision-rappel dans l'évaluation des performances ,2015,fr,2,2,2,Apprentissage,pas encore
246,Contribution au calcul du skyline par réduction de l'espace candidat,2015,fr,2,2,2,Apprentissage,pas encore
247,D113 : une plateforme open-source dédiée à l'analyse des flux et à la détection des intrusions,2015,fr,2,2,2,Apprentissage,pas encore
248,Découverte de proportions analogiques dans les bases de données : une première approche,2015,fr,3,3,3,Motifs,pas encore
249,Détection automatique de reformulations - Correspondance de concepts appliquée à la détection du plagiat,2015,fr,2,2,2,Apprentissage,pas encore
250,Détection et regroupement automatique de style d'écriture dans un texte,2015,fr,2,2,2,Apprentissage,pas encore
251,Deux approches pour catégoriser le risque,2015,fr,2,2,2,Apprentissage,pas encore
252,Échantillonnage de flux de données sémantiques : Une approche orientée graphe,2015,fr,4,4,4,Motifs,pas encore
253,Etude de La Pertinence lors de La Sélection de Collections dans les Systèmes Distribués,2015,fr,3,3,3,Apprentissage,pas encore
254,Extraction complète efficace de chemins pondérés dans un a-DAG,2015,fr,5,5,5,Règles,pas encore
255,Extraction de l'intérêt implicite des utilisateurs dans les attributs des items pour améliorer les systèmes de recommandations,2015,fr,3,3,3,Apprentissage,pas encore
257,gapIT : Un outil visuel pour l'imputation de valeurs manquantes en hydrologie,2015,fr,6,6,6,Apprentissage,pas encore
258,Gestion de l'incertitude dans le cadre d'une extraction des connaissances à partir de texte,2015,fr,2,2,2,Règles,pas encore
259,Heuristiques pour l'adaptation des mappings entre ontologies dynamiques,2015,fr,3,3,3,Ontologies,pas encore
260,Identification d'auteurs par apprentissage automatique,2015,fr,3,3,3,Apprentissage,pas encore
261,Identification des utilisateurs atypiques dans les systèmes de recommandation sociale,2015,fr,3,3,3,Apprentissage,pas encore
262,L'apport d'une approche symbolique pour le repérage des entités nommées en langue amazighe,2015,fr,3,3,3,Apprentissage,pas encore
266,Mesure d'influence via les indicateurs de centralité dans les réseaux sociaux,2015,fr,2,2,2,Apprentissage,pas encore
267,Méthode alternative à la détection de « copier/coller » : intersection de textes et construction de séquences maximales communes ,2015,fr,2,2,2,Spatio-temporel,pas encore
269,"Modèle de Biclustering dans un paradigme ""Mapreduce""",2015,fr,3,3,3,Apprentissage,pas encore
270,Nouvelle approche de contextualisation de tweets basée sur les règles d'association inter-termes,2015,fr,4,4,4,Flux,pas encore
271,Pour une meilleure exploitation de la classification croisée dans les systèmes de filtrage collaboratif,2015,fr,4,4,4,Images,pas encore
272,Proposition d'outil de clustering visuel et interactif,2015,fr,4,4,4,Apprentissage,pas encore
273,Qualité et complexité en évaluation des mesures d'intérêt,2015,fr,3,3,3,Apprentissage,pas encore
274,RankMerging: Apprentissage supervisé de classements pour la prédiction de liens dans les grands réseaux sociaux,2015,fr,3,3,3,Apprentissage,pas encore
275,Réduction de la complexité spatiale et temporelle du Compact Prediction Tree pour la prédiction de séquences,2015,fr,2,2,2,Spatio-temporel,pas encore
276,Regroupement d'attributs par règles d'association dans les systèmes d'inférence floue,2015,fr,2,2,2,Flux,pas encore
277,Régularisation de noyaux temporellement élastiques et analyse en composantes principales non-linéaire pour la fouille de séries temporelles ,2015,fr,1,1,1,Spatio-temporel,pas encore
278,Requêtes Skyline en présence des données évidentielles,2015,fr,5,5,5,Motifs,pas encore
282,Un algorithme EM pour une version parcimonieuse de l'analyse en composantes principales probabiliste,2015,fr,2,2,2,Apprentissage,pas encore
283,Un algorithme ICM basé sur la compacité pour la segmentation des images satellites à très haute résolution,2015,fr,3,3,3,Apprentissage,pas encore
284,Un langage d'interrogation à la SPARQL pour les graphes conceptuels,2015,fr,3,3,3,Apprentissage,pas encore
285,Une approche centrée graine pour la détection de communautés dans les réseaux multiplexes,2015,fr,3,3,3,Apprentissage,pas encore
286,Une approche de visualisation analytique pour comparer les modèles de propagation dans les réseaux sociaux,2015,fr,3,3,3,Apprentissage,pas encore
287,Une nouvelle formalisation des changements ontologiques composés et complexes,2015,fr,4,4,4,Apprentissage,pas encore
288,Une nouvelle méthode de Web Usage Mining basée sur une analyse sémiotique du comportement de navigation,2015,fr,3,3,3,Extraction,pas encore
289,Une Plateforme ETL parallèle et distribuée pour l'intégration de données massives,2015,fr,4,4,4,Motifs,pas encore
291,Utilisation des pyramides pour visualiser la contamination des manuscrits,2015,fr,1,1,1,Apprentissage,pas encore
292,Vers la découverte de modèles exceptionnels locaux : des règles descriptives liant les molécules à leurs odeurs,2015,fr,6,6,6,Apprentissage,pas encore
294,XEWGraph : Outil de Visualisation et Analyse des Hypergraphes pour un Système d'Intelligence Economique,2015,fr,5,5,5,Apprentissage,pas encore
295,1d-SAX : une nouvelle représentation symbolique pour les séries temporelles,2014,fr,4,4,4,Spatio-temporel,pas encore
296,Agrégation de sac-de-sacs-de-mots pour la recherche d'information par modèles vectoriels,2014,fr,1,1,1,Apprentissage,pas encore
297,Alignement d'ontologies : exploitation des ontologies liées sur le web de données,2014,fr,5,5,5,Ontologies,pas encore
298,Annotation sémantique de documents administratifs,2014,fr,4,4,4,Visualisation,pas encore
299,Application du paradigme MapReduce aux données ouvertes Cas : Accessibilité des personnes à mobilité réduite aux musées,2014,fr,4,4,4,Motifs,pas encore
300,Apprentissage de fonctions de tri pour la prédiction d'interactions protéine-ARN,2014,fr,4,4,4,Apprentissage,pas encore
301,Apprentissage incrémental anytime d'un classifieur Bayésien naïf pondéré,2014,fr,3,3,3,Apprentissage,pas encore
302,"Apprentissage non supervisé de dépendances syntaxiques à partir de texte étiqueté, plusieurs variantes de PCFG légères",2014,fr,4,4,4,Apprentissage,pas encore
303,Approche formelle de fusion d'ontologies à l'aide des grammaires de graphes typés,2014,fr,4,4,4,Ontologies,pas encore
304,Approche par motifs pour l'analyse de données multi-résolution,2014,fr,3,3,3,Décisionnel,pas encore
307,Classification des actions humaines basée sur les descripteurs spatio-temporels,2014,fr,3,3,3,Spatio-temporel,pas encore
308,Classification et prédiction du flux solaire,2014,fr,4,4,4,Images,pas encore
309,Classifieur naïf de Bayes pondéré pour flux de données,2014,fr,3,3,3,Motifs,pas encore
310,Clustering de données relationnelles pour la structuration de flux télévisuels,2014,fr,2,2,2,Motifs,pas encore
311,Clustering de séquences d'évènements temporels,2014,fr,4,4,4,Spatio-temporel,pas encore
312,Clusters dans les réseaux sociaux : intersections entre liens conceptuels fréquents et communautés,2014,fr,2,2,2,Apprentissage,pas encore
313,Comment Devenir Cybercondriaque ?,2014,fr,2,2,2,Apprentissage,pas encore
314,Comparaison de bornes théoriques pour l'accélération du clustering incrémental en une passe,2014,fr,3,3,3,Apprentissage,pas encore
315,Comparaison des chemins de Hilbert adaptatif et des graphes de voisinage pour la caractérisation d'un parcellaire agricole,2014,fr,4,4,4,Apprentissage,pas encore
316,Compréhension de recettes de cuisine utilisateurs par extraction de connaissances intrinsèques,2014,fr,3,3,3,Règles,pas encore
317,Construction de cube OLAP à partir d'un entrepôt de données orienté colonnes,2014,fr,4,4,4,Motifs,pas encore
318,Construction de profils de préférences contextuelles basée sur l'extraction de motifs séquentiels,2014,fr,3,3,3,Décisionnel,pas encore
319,De l'ombre à la lumière : plus de visibilité sur l'Eclipse,2014,fr,3,3,3,Apprentissage,pas encore
320,De nouvelles pondérations adaptées à la classification de petits volumes de données textuelles,2014,fr,3,3,3,Images,pas encore
321,Des humanités au numérique : interdisciplinarité et réciprocité,2014,fr,1,1,1,Apprentissage,pas encore
322,Détection d'opinions dans des tweets,2014,fr,4,4,4,Apprentissage,pas encore
323,Détection de changements dans des flots de données qualitatives,2014,fr,4,4,4,Motifs,pas encore
324,Détection de situations à risque basée sur des détecteurs de mouvement à domicile pour les personnes dépendantes,2014,fr,4,4,4,Apprentissage,pas encore
325,Du texte à la base de données géographiques,2014,fr,3,3,3,Motifs,pas encore
326,Dynamique des communautés par prédiction d'interactions dans les réseaux sociaux,2014,fr,2,2,2,Apprentissage,pas encore
327,Evaluation de la pertinence dans un système de recommandation sémantique de nouvelles économiques,2014,fr,3,3,3,Apprentissage,pas encore
328,Exploration d'une collection de chansons à partir d'une interface de visualisation basée sur une analyse des paroles,2014,fr,3,3,3,Apprentissage,pas encore
329,Extension de l'étiquetage géographique des pixels d'une image par fouille de données,2014,fr,4,4,4,Motifs,pas encore
330,Extraction de motifs dans des graphes orientés attribués en présence d'automorphisme,2014,fr,4,4,4,Décisionnel,pas encore
331,Extraction de règles d'épisodes minimales dans des séquences complexes,2014,fr,3,3,3,Spatio-temporel,pas encore
332,Extraire les motifs minimaux efficacement et en profondeur,2014,fr,2,2,2,Décisionnel,pas encore
333,Fouille de données par programmation visuelle structurée avec KD-Ariane,2014,fr,2,2,2,Motifs,pas encore
334,Fouille de motifs séquentiels pour l'élicitation de stratégies à partir de traces d'interactions entre agents en compétition,2014,fr,4,4,4,Décisionnel,pas encore
335,Généralisation des k-moyennes pour produire des recouvrements ajustables,2014,fr,3,3,3,Apprentissage,pas encore
336,Génération d'un extrait textuel à partir de bases de données,2014,fr,3,3,3,Motifs,pas encore
337,Granularité des motifs de co-variations dans des graphes attribués dynamiques,2014,fr,3,3,3,Décisionnel,pas encore
338,Identification de classes non-disjointes ayants des densités différentes,2014,fr,3,3,3,Apprentissage,pas encore
339,Identification de rôles communautaires dans des réseaux orientés appliquée à Twitter,2014,fr,3,3,3,Apprentissage,pas encore
341,Intégration de plusieurs formes de représentations spatiales dans un modèle de simulation,2014,fr,4,4,4,Apprentissage,pas encore
342,Intégration et visualisation de données liées thématiques sur un référentiel géographique,2014,fr,3,3,3,Motifs,pas encore
343,Investigation visuelle d'événements dans un grand flot de liens,2014,fr,2,2,2,Apprentissage,pas encore
344,L'utilisation des entités nommées pour l'expansion sémantique des requêtes Web,2014,fr,3,3,3,Extraction,pas encore
345,La subjectivité dans le discours médical : sur les traces de l'incertitude et des émotions,2014,fr,2,2,2,Apprentissage,pas encore
346,Les nouvelles théories de l'incertain,2014,fr,1,1,1,Apprentissage,pas encore
347,"LOCAL-GENERATOR : ""diviser pour régner"" pour l'extraction des traverses minimales d'un hypergraphe",2014,fr,3,3,3,Règles,pas encore
348,Méthodologie 3-way d'extraction d'un modèle articulatoire de la parole à partir des données d'un locuteur,2014,fr,2,2,2,Règles,pas encore
350,Modélisation de trajectoires cible/caméra : requêtes spatio-temporelles dans le cadre de la videosurveillance,2014,fr,3,3,3,Spatio-temporel,pas encore
351,Motifs récursifs : extraction ascendante hiérarchique d'ensembles d'items ou d'évènements pour le résumé de données transactionnelles ou séquentielles,2014,fr,1,1,1,Décisionnel,pas encore
352,Passage aux noyaux en classification recouvrante,2014,fr,1,1,1,Images,pas encore
353,Pondération de blocs de variables en bi-partitionnement topologique,2014,fr,3,3,3,Apprentissage,pas encore
354,Prédiction de valeurs manquantes dans les bases de données— Une première approche fondée sur la notion de proportion analogique,2014,fr,3,3,3,Apprentissage,pas encore
355,Que ressentent les patients ?,2014,fr,6,6,6,Apprentissage,pas encore
356,Réconciliation des profils dans les réseaux sociaux,2014,fr,4,4,4,Apprentissage,pas encore
357,Reconstruction et analyse sémantique de chronologies cybercriminelles,2014,fr,4,4,4,Apprentissage,pas encore
358,Règles d'association inter-langues au service de la recherche d'information multilingue,2014,fr,4,4,4,Flux,pas encore
360,Requêtes skyline en présence d'exceptions,2014,fr,3,3,3,Apprentissage,pas encore
361,Sélection d'une méthode de classification multi-label pour un système interactif,2014,fr,3,3,3,Images,pas encore
362,Sélection de prototypes en vue d'une catégorisation de textes avec les K plus proches voisins : étude comparative,2014,fr,4,4,4,Apprentissage,pas encore
363,Sous échantillonnage et machine à noyaux élastiques pour la classification de données de mouvement capturé,2014,fr,3,3,3,Images,pas encore
364,Stratégies argumentatives pour la classification collaborative multicritères des connaissances cruciales,2014,fr,2,2,2,Images,pas encore
365,Symétries et Extraction de Motifs Ensemblistes,2014,fr,5,5,5,Décisionnel,pas encore
367,Un système de détection de thématiques populaires sur Twitter,2014,fr,2,2,2,Apprentissage,pas encore
368,Une approche algébrique au problème du consensus de partitions,2014,fr,3,3,3,Apprentissage,pas encore
369,Une approche basée sur STATIS pour la fusion de cartes topologiques auto-organisées,2014,fr,5,5,5,Apprentissage,pas encore
370,Une approche PPC pour la fouille de données séquentielles,2014,fr,3,3,3,Motifs,pas encore
371,Une approcheWeb sémantique et combinatoire pour un système de recommandation sensible au contexte appliqué à l'apprentissage mobile,2014,fr,3,3,3,Apprentissage,pas encore
372,Une heuristique pour le paramétrage automatique de l'algorithme de clustering spectral,2014,fr,3,3,3,Apprentissage,pas encore
373,Une méthode hybride pour la prédiction du profil des auteurs,2014,fr,3,3,3,Apprentissage,pas encore
374,Une méthode pour caractériser les communautés des réseaux dynamiques à attributs,2014,fr,4,4,4,Apprentissage,pas encore
375,Une méthode pour la détection de thématiques populaires sur Twitter,2014,fr,2,2,2,Apprentissage,pas encore
376,Une nouvelle approche pour la sélection de variables basée sur une métrique d'estimation de la qualité,2014,fr,3,3,3,Apprentissage,pas encore
377,Utilisation de relations ontologiques pour la comparaison d'images décrites par des annotations sémantiques,2014,fr,2,2,2,Apprentissage,pas encore
378,Vectorisation paramétrée des données textuelles,2014,fr,5,5,5,Motifs,pas encore
379,Vers une classification non supervisée adaptée pour obtenir des arbres de décision simplifiés,2014,fr,4,4,4,Images,pas encore
380,Vers une modularité pour données vectorielles,2014,fr,4,4,4,Motifs,pas encore
381,Visualisation de données de prosopographie pour la reconstruction de carrières de personnages et de réseaux socio-professionnels,2014,fr,2,2,2,Motifs,pas encore
382,20 ans de découverte de motifs : une étude bibliographique quantitative,2013,fr,3,3,3,Décisionnel,pas encore
383,3D : de nouvelles perspectives en fouille exploratoire avec la stéréoscopie,2013,fr,3,3,3,Apprentissage,pas encore
385,Accélération de la méthode des K plus proches voisins pour la catégorisation de textes,2013,fr,4,4,4,Apprentissage,pas encore
386,Analyse conceptuelle de données de simulation de systèmes complexes pour l'aide à la décision : Application à la conception d'une cabine d'avion,2013,fr,5,5,5,Motifs,pas encore
387,Analyse de réseaux sociaux par l'analyse formelle de concepts,2013,fr,1,1,1,Apprentissage,pas encore
388,Analyse des réclamations d'allocataires de la CAF : un cas d'étude en fouille de données,2013,fr,5,5,5,Motifs,pas encore
389,Analyse Relationnelle de Concepts pour l'exploration de données relationnelles,2013,fr,4,4,4,Motifs,pas encore
390,Approche orientée objet sémantique et coopérative pour la classification des images de zones urbaines à très haute résolution,2013,fr,4,4,4,Images,pas encore
391,Classification multi-étiquettes pour l'alignement multiple de séquences protéiques,2013,fr,4,4,4,Spatio-temporel,pas encore
392,Classifications croisées de données de trajectoires contraintes par un réseau routier,2013,fr,4,4,4,Images,pas encore
393,Comprendre et interpréter les données : enjeux et implantations d'un système de codage dans des gisements de données historiques,2013,fr,2,2,2,Motifs,pas encore
394,Construction de descripteurs à partir du coclustering pour la classification supervisée de séries temporelles,2013,fr,2,2,2,Spatio-temporel,pas encore
395,Découverte des soft-skypatterns avec une approche PPC,2013,fr,5,5,5,Apprentissage,pas encore
397,Détection efficace des traverses minimales d'un hypergraphe par élimination de la redondance,2013,fr,3,3,3,Apprentissage,pas encore
398,Détection précoce de tendances produits dans le cadre des activités commerciales de la grande distribution,2013,fr,2,2,2,Apprentissage,pas encore
399,Enrichissement d'ontologies grâce à l'annotation sémantique de pages web,2013,fr,4,4,4,Extraction,pas encore
400,Étude des corrélations spatio-temporelles des appels mobiles en France,2013,fr,3,3,3,Spatio-temporel,pas encore
401,Étude des techniques d'oubli dans les moindres carrés récursifs pour l'apprentissage incrémental de systèmes d'inférence floue évolutifs : application à la reconnaissance de formes,2013,fr,3,3,3,Apprentissage,pas encore
402,Évolution d'une ontologie dédiée à la représentation de relations n-aires,2013,fr,4,4,4,Ontologies,pas encore
403,Extraction de motifs condensés dans un unique graphe orienté acyclique attribué,2013,fr,4,4,4,Décisionnel,pas encore
404,Extraction de motifs fréquents dans des arbres attribués,2013,fr,4,4,4,Décisionnel,pas encore
405,Extraction des nombres de Betti avec un modèle génératif,2013,fr,3,3,3,Règles,pas encore
406,Extraction et filtrage de syntagmes nominaux pour la Recherche d'Information,2013,fr,2,2,2,Règles,pas encore
407,Extraction optimisée de Règles d'Association Positives et Négatives (RAPN),2013,fr,2,2,2,Flux,pas encore
408,Grille bivariée pour la détection de changement dans un flux étiqueté,2013,fr,3,3,3,Apprentissage,pas encore
409,Identification de compatibilités entre descripteurs de lieux et apprentissage automatique,2013,fr,4,4,4,Apprentissage,pas encore
410,Identification de complexes protéine-protéine par combinaison de classifieurs. Application à Escherichia Coli,2013,fr,3,3,3,Apprentissage,pas encore
411,Inférence de réseaux biologiques : un défi pour la fouille de données structurées,2013,fr,1,1,1,Motifs,pas encore
412,Les capitalistes sociaux sur Twitter : détection via des mesures de similarité,2013,fr,2,2,2,Apprentissage,pas encore
413,Modèle de Recherche d'Information Sociale Centré Utilisateur,2013,fr,3,3,3,Apprentissage,pas encore
415,Nouvelle approche de bi-partitionnement topologique,2013,fr,3,3,3,Apprentissage,pas encore
416,Paramétrage intelligent de l'alignement d'ontologies par l'intégrale de Choquet,2013,fr,3,3,3,Ontologies,pas encore
417,Processus itératif d'extraction de classes en non supervisée,2013,fr,2,2,2,Images,pas encore
418,Ré-écriture de requêtes dans un système d'intégration sémantique,2013,fr,4,4,4,Apprentissage,pas encore
419,Recherche de documents similaires sur le web par segmentations hiérarchiques et extraction de mots-clés,2013,fr,1,1,1,Extraction,pas encore
420,Réutiliser les connaissances d'expert pour assister l'analyse de l'activité sur simulateur pleine échelle de conduite de centrale nucléaire - Approche à base de M-Trace,2013,fr,2,2,2,Règles,pas encore
421,Sélection de variables non supervisée sous contraintes hiérarchiques,2013,fr,3,3,3,Images,pas encore
422,"SNOW, un algorithme exploratoire pour le subspace clustering",2013,fr,2,2,2,Apprentissage,pas encore
423,Technique de factorisation multi-biais pour des recommandations dynamiques,2013,fr,3,3,3,Apprentissage,pas encore
424,Text2Geo : des données textuelles aux informations géospatiales,2013,fr,5,5,5,Motifs,pas encore
425,ToTeM: une méthode de détection de communautés adaptées aux réseaux d'information,2013,fr,4,4,4,Apprentissage,pas encore
427,Un Critère d'évaluation pour la construction de variables à base d'itemsets pour l'apprentissage supervisé multi-tables,2013,fr,3,3,3,Apprentissage,pas encore
428,Un système hybride de recherche d'information intégrant le raisonnement à partir de cas et la composition d'ontologies,2013,fr,3,3,3,Ontologies,pas encore
429,Une approche en programmation par contraintes pour la classification non supervisée,2013,fr,3,3,3,Images,pas encore
430,Une nouvelle mesure pour l'évaluation des méthodes d'extraction de thématiques : la Vraisemblance Généralisée,2013,fr,4,4,4,Règles,pas encore
433,Vers un cadre évolutif de classification non supervisée,2013,fr,3,3,3,Images,pas encore
434,Vers une architecture multicouche d'ontologies dédiée à la résolution mixte de problèmes,2013,fr,3,3,3,Ontologies,pas encore
435,Vers une Automatisation de la Construction de Variables pour la Classification Supervisée,2013,fr,2,2,2,Images,pas encore
436,Vers une mesure de similarité pour les séquences complexes,2013,fr,6,6,6,Spatio-temporel,pas encore
437,Visualisation radiale : approche parallèle entre CPU et GPU,2013,fr,3,3,3,Apprentissage,pas encore
439,Apprentissage d'ensemble d'opérateurs de projection orthogonale pour la détection de nouveauté,2012,fr,2,2,2,Apprentissage,pas encore
440,Apprentissage par analyse linéaire discriminante des paramètres de fusion pour la recherche d'information multimédia texte-image,2012,fr,5,5,5,Apprentissage,pas encore
442,Caractérisation et extraction de biclusters de valeurs similaires avec l'analyse de concepts triadiques,2012,fr,5,5,5,Règles,pas encore
443,Classification Conceptuelle avec Généralisation par Intervalles,2012,fr,2,2,2,Images,pas encore
444,Classification de données EEG par algorithme évolutionnaire pour l'étude d'états de vigilance,2012,fr,5,5,5,Images,pas encore
445,Classification des données catégorielles via la maximisation spectrale de la modularité,2012,fr,2,2,2,Images,pas encore
446,Classification probabiliste non supervisée et visualisation des données séquentielles,2012,fr,3,3,3,Images,pas encore
447,Classification topologique probabiliste pour des données catégorielles,2012,fr,2,2,2,Images,pas encore
448,Clustering de séquences d'activités pour l'étude de procédures neurochirurgicales,2012,fr,5,5,5,Spatio-temporel,pas encore
449,Clustering hiérarchique non paramétrique de données fonctionnelles,2012,fr,3,3,3,Motifs,pas encore
450,Clustering multi-niveaux de graphes : hiérarchique et topologique,2012,fr,3,3,3,Apprentissage,pas encore
451,Combinaison de classificateurs simples pour une sélection rapide de caractéristiques,2012,fr,4,4,4,Apprentissage,pas encore
452,Combinaison de classification supervisée et non-supervisée par la théorie des fonctions de croyance,2012,fr,3,3,3,Images,pas encore
454,Découverte de règles d'association pour l'aide à la prévision des accidents maritimes,2012,fr,2,2,2,Flux,pas encore
455,Détection de groupes outliers en classification non supervisée,2012,fr,3,3,3,Images,pas encore
456,Détection non supervisée d'une sous-population par méthode d'ensemble et changement de représentation itératif,2012,fr,2,2,2,Images,pas encore
459,Evaluation rapide du diamètre d'un graphe,2012,fr,3,3,3,Apprentissage,pas encore
460,Exploitation de l'asymétrie entre termes pour l'extraction automatique de taxonomies à partir de textes,2012,fr,4,4,4,Règles,pas encore
461,Extraction d'opinions appliquée à des critères,2012,fr,5,5,5,Règles,pas encore
