id,title,year,language,Nb_authors,Nb_male,Nb_female,theme,keywords
462,Extraction de co-variations entre des propriétés de sommets et leur position topologique dans un graphe attribué,2012,fr,4,4,4,Règles,pas encore
463,Extraction de Dépendances Fonctionnelles Approximatives,2012,fr,2,2,2,Règles,pas encore
464,Extraction de Liens Fréquents dans les Réseaux Sociaux,2012,fr,2,2,2,Apprentissage,pas encore
465,Extraction de séquences fréquentes avec intervalles d'incertitude,2012,fr,4,4,4,Spatio-temporel,pas encore
466,Extraction de sous-parties ciblées d'une ontologie généraliste pour enrichir une ontologie particulière,2012,fr,3,3,3,Ontologies,pas encore
467,Extraction et gestion d'informations pour la construction d'une base vidéo d'apprentissage,2012,fr,1,1,1,Règles,pas encore
468,Extraction incrémentale de séquences fréquentes dans un flux d'itemsets,2012,fr,2,2,2,Spatio-temporel,pas encore
470,Identification et caractérisation de différents types de boycott par des méthodes d'Analyse de Données,2012,fr,2,2,2,Motifs,pas encore
471,K-moyennes contraintes par un classifieur Application à la personnalisation de scores de campagnes,2012,fr,3,3,3,Apprentissage,pas encore
472,L'extraction de règles de dépendance bien définies entre ensembles de variables multivaluées,2012,fr,1,1,1,Flux,pas encore
473,Méta-règles pour la génération de règles négatives,2012,fr,2,2,2,Flux,pas encore
475,Modèle de supervision d'interactions non-intrusif basé sur les ontologies,2012,fr,4,4,4,Ontologies,pas encore
477,Prétraitement Supervisé des Variables Numériques pour la Fouille de Données Multi-Tables,2012,fr,3,3,3,Motifs,pas encore
478,Raisonner sur une ontologie cartographique pour concevoir des légendes de cartes,2012,fr,3,3,3,Ontologies,pas encore
479,Recherche d'Information Agrégée dans des documents XML basée sur les Réseaux Bayésiens,2012,fr,3,3,3,Visualisation,pas encore
481,Réorganisation hiérarchique de visualisations dans OLAP,2012,fr,4,4,4,Apprentissage,pas encore
482,Représentations de services web : impact sur la découverte et la recommandation,2012,fr,4,4,4,Extraction,pas encore
483,RICSH : Recherche d'information contextuelle par segmentation thématique de documents,2012,fr,3,3,3,Visualisation,pas encore
484,Sélection Bayésienne de Modèles avec Prior Dépendant des Données,2012,fr,1,1,1,Motifs,pas encore
486,Structuration des décisions de jurisprudence basée sur une ontologie juridique en langue arabe,2012,fr,3,3,3,Ontologies,pas encore
487,SweetDeki : le wiki sémantique couteau suisse du réseau social ISICIL,2012,fr,3,3,3,Apprentissage,pas encore
488,TMD-MINER : Une nouvelle approche pour la détection des diffuseurs dans un système communautaire,2012,fr,3,3,3,Apprentissage,pas encore
490,Transformation de l'espace de description pour l'apprentissage par transfert,2012,fr,3,3,3,Apprentissage,pas encore
491,Un algorithme de classification automatique pour des données relationnelles multi-vues,2012,fr,4,4,4,Images,pas encore
492,Un assistant utilisateur pour le choix et le paramétrage des méthodes de fouille visuelle de données,2012,fr,4,4,4,Motifs,pas encore
493,Un environnement efficace pour la classification d'images à grande échelle,2012,fr,2,2,2,Images,pas encore
494,Une approche multidimensionnelle basée sur les comportements individuels pour la prédiction de la diffusion de l'information sur Twitter,2012,fr,3,3,3,Apprentissage,pas encore
495,Une distance hiérarchique basée sur la sémantique pour la comparaison d'histogrammes nominaux,2012,fr,1,1,1,Apprentissage,pas encore
497,Utilisation d'invariants pour une médiation inter-domaines de modèles utilisateurs : ressources invariantes et invariants sémantiques,2012,fr,3,3,3,Apprentissage,pas encore
498,Validation et optimisation d'une décomposition hiérarchique de graphes,2012,fr,1,1,1,Apprentissage,pas encore
499,Vers la construction d'un observatoire des pratiques agricoles : gestion et propagation de l'imprécision des données agronomiques,2012,fr,5,5,5,Motifs,pas encore
500,Vers une approche efficace d'extraction de motifs spatio-séquentiels,2012,fr,5,5,5,Décisionnel,pas encore
501,Vers une méthode automatique de construction de hiérarchies contextuelles,2012,fr,4,4,4,Apprentissage,pas encore
502,Webmarks : Le marquage d'intérêt sur le Web de données,2012,fr,2,2,2,Extraction,pas encore
503,@KRex : une méthode de construction des connaissances pour la maîtrise des activités à risques - application au domaine de la sécurité nucléaire,2011,fr,3,3,3,Règles,pas encore
504,A la recherche des tweets porteurs d'informations journalistiques,2011,fr,4,4,4,Apprentissage,pas encore
505,Acquisition de structures lexico-sémantiques à partir de textes : un nouveau cadre de travail fondé sur une structuration prétopologique,2011,fr,3,3,3,Apprentissage,pas encore
506,Adaptation de l'algorithme CART pour la tarification des risques en assurance non-vie,2011,fr,3,3,3,Apprentissage,pas encore
507,Agrégation robuste de données massives à la volée : application aux compteurs électriques communicants,2011,fr,2,2,2,Motifs,pas encore
508,Aide à l'Analyse Visuelle de Réseaux Sociaux pour la Détection de Comportements Suspects,2011,fr,4,4,4,Apprentissage,pas encore
509,Algorithmes de recherche exhaustif et guidé pour la recommandation d'un expert dans un réseau professionnel,2011,fr,1,1,1,Apprentissage,pas encore
510,Analyse comparative de méthodologies et d'outils de construction automatique d'ontologies à partir de ressources textuelles,2011,fr,4,4,4,Ontologies,pas encore
511,Analyse du comportement limite d'indices probabilistes pour une sélection discriminante,2011,fr,2,2,2,Apprentissage,pas encore
512,Analyse factorielle des correspondances hiérarchique pour la fouille d'images,2011,fr,4,4,4,Apprentissage,pas encore
513,Analyse spatiotemporelle des vecteurs de mouvement : application au comptage des personnes,2011,fr,4,4,4,Apprentissage,pas encore
514,Annotation d'entités nommées par extraction de règles de transduction,2011,fr,2,2,2,Flux,pas encore
515,Apport de la catégorisation iconique pour la gestion coopérative des connaissances1,2011,fr,3,3,3,Apprentissage,pas encore
516,Apport des données thématiques dans les systèmes de recommandation : hybridation et démarrage à froid,2011,fr,4,4,4,Motifs,pas encore
517,Apprendre les contraintes topologiques dans les cartes auto-organisatrices,2011,fr,2,2,2,Apprentissage,pas encore
518,Apprentissage génératif de la structure de réseaux logiques de Markov à partir d'un graphe des prédicats,2011,fr,3,3,3,Apprentissage,pas encore
519,"Cartes cognitives : une exploitation à base d'échelle, vue et profil",2011,fr,4,4,4,Apprentissage,pas encore
520,Catégorisation des mesures d'intérêt pour l'extraction des connaissances,2011,fr,3,3,3,Règles,pas encore
521,Classificateurs aléatoires Topologiques à base de graphes de voisinage,2011,fr,2,2,2,Apprentissage,pas encore
522,Classification des aéronefs par estimation de la pose,2011,fr,4,4,4,Images,pas encore
524,Comparaison entre deux indices pour l'évaluation probabiliste discriminante des règles d'association,2011,fr,2,2,2,Flux,pas encore
526,Conception et implémentation d'une nouvelle technique cellulaire de discrétisation : intégration dans TANAGRA,2011,fr,2,2,2,Apprentissage,pas encore
527,Construction d'une Ontologie d'aide au renforcement de la sécurité des systèmes de transport automatisés.,2011,fr,4,4,4,Ontologies,pas encore
528,Construction ontologique à partir de séquences d'expression de champignons,2011,fr,4,4,4,Spatio-temporel,pas encore
530,Découverte de motifs d'évolution significatifs dans les séries temporelles d'images satellites,2011,fr,3,3,3,Spatio-temporel,pas encore
531,Des graphes de documents aux réseaux sociaux,2011,fr,2,2,2,Visualisation,pas encore
532,Détection de changements de distribution dans un flux de données : une approche supervisée,2011,fr,2,2,2,Motifs,pas encore
533,Détection de redondances dans les tableaux guidée par une ontologie,2011,fr,4,4,4,Ontologies,pas encore
534,Détection des profils à long terme et à court terme dans les réseaux sociaux,2011,fr,3,3,3,Apprentissage,pas encore
537,Equilibrer l'analyse des motifs fréquents,2011,fr,3,3,3,Décisionnel,pas encore
538,Equivalence topologique entre mesures de proximité,2011,fr,3,3,3,Apprentissage,pas encore
539,Estimation de la densité d'arcs dans les graphes de grande taille: une alternative à la détection de clusters,2011,fr,1,1,1,Apprentissage,pas encore
540,Être ou ne pas être usager d'internet telle est la question ?,2011,fr,4,4,4,Apprentissage,pas encore
541,Evaluation des outils d'extraction terminologique Quezao et Acabit,2011,fr,3,3,3,Règles,pas encore
542,Extraction de motifs séquentiels contextuels,2011,fr,2,2,2,Décisionnel,pas encore
543,Extraction de motifs temporels à partir de séquences d'événements avec intervalles temporels,2011,fr,2,2,2,Spatio-temporel,pas encore
544,Extraction et Analyse de réseaux sociaux issus de Bases de Données Relationnelles,2011,fr,6,6,6,Motifs,pas encore
545,Extraction sous contraintes d'ensembles de cliques homogènes,2011,fr,5,5,5,Règles,pas encore
546,Heuristique pour l'extraction de motifs ensemblistes bruités,2011,fr,3,3,3,Décisionnel,pas encore
547,Import automatique et interactif de données dans les systèmes de visualisations,2011,fr,2,2,2,Motifs,pas encore
548,Intégration de données haptiques brutes dans des systèmes experts de diagnostic des connaissances,2011,fr,2,2,2,Règles,pas encore
549,Interprétation graphique de la courbe ROC,2011,fr,1,1,1,Apprentissage,pas encore
551,Introduction de l'ingénierie ontologique dans la méthodologie de développement des progiciels de gestion des collectivités territoriales,2011,fr,2,2,2,Apprentissage,pas encore
552,ISICIL : Intégration Sémantique d'Informations à travers des Communautés d'Intelligence en Ligne,2011,fr,10,10,10,Apprentissage,pas encore
553,Les moteurs de wikis sémantiques : un état de l'art,2011,fr,4,4,4,Apprentissage,pas encore
554,M3A : Une plateforme d'ingénierie de maintenance assistée par apprentissage automatique,2011,fr,2,2,2,Apprentissage,pas encore
555,Mesure de concordance pour les bases de données évidentielles,2011,fr,3,3,3,Motifs,pas encore
556,Mesures d'hétérogénéité sémantique des systèmes P2P non-structurés,2011,fr,3,3,3,Apprentissage,pas encore
557,Mixer les moyens pour extraire les gloses,2011,fr,3,3,3,Apprentissage,pas encore
559,Modèle pour une analyse du phénomène de linéarité de catégories sémantiques dans les énoncés en français,2011,fr,1,1,1,Apprentissage,pas encore
560,Modélisation d'une ressource termino-ontologique de domaine pour l'annotation sémantique de tableaux,2011,fr,4,4,4,Apprentissage,pas encore
561,Modélisation de la dynamique de phénomènes spatio-temporels par des séquences de motifs,2011,fr,3,3,3,Spatio-temporel,pas encore
562,Modélisation de la propagation de l'information sur le Web : de l'extraction des données à la simulation,2011,fr,4,4,4,Extraction,pas encore
563,Moteur de questions réponses à partir de données du web sémantique,2011,fr,1,1,1,Extraction,pas encore
564,Moteur de questions-réponses d'une base de connaissances,2011,fr,2,2,2,Règles,pas encore
566,MuMIe: Une Approche Automatique pour l'Interopérabilité des Métadonnées,2011,fr,4,4,4,Apprentissage,pas encore
567,Nomao : la recherche géolocalisée personnalisée,2011,fr,1,1,1,Apprentissage,pas encore
568,Nouvelle approche de fouille de graphes AC-réduits fréquents,2011,fr,4,4,4,Apprentissage,pas encore
569,Optimisation de l'extraction de l'alignement des ontologies avec la contrainte de différence,2011,fr,2,2,2,Ontologies,pas encore
570,Optimisation directe des poids de modèles dans un prédicteur Bayésien naïf moyenné,2011,fr,2,2,2,Apprentissage,pas encore
573,Pondération et classification simultanée de données binaires et continues,2011,fr,3,3,3,Images,pas encore
574,PPMI : étude formelle d'une variante à valeurs positives de la PMI,2011,fr,2,2,2,Apprentissage,pas encore
575,Prévision de trajectoires de cyclones à l'aide de forêts aléatoires avec arbres de régression,2011,fr,4,4,4,Visualisation,pas encore
576,Prise en compte du réseau de sources pour la fusion d'informations,2011,fr,4,4,4,Apprentissage,pas encore
577,"Propositionaliser des attributs numériques sans les discrétiser, ni les agréger",2011,fr,2,2,2,Apprentissage,pas encore
579,Reconnaissance d'Actions par Modélisation du Mouvement,2011,fr,4,4,4,Apprentissage,pas encore
580,Résumés et interrogations de logs de requêtes OLAP,2011,fr,3,3,3,Apprentissage,pas encore
581,Sélection des variables informatives pour l'apprentissage supervisé multi-tables,2011,fr,3,3,3,Images,pas encore
582,Service de recherche Web3.0 de contenus audiovisuels,2011,fr,2,2,2,Apprentissage,pas encore
583,Structuration automatique des flux télévisuels par apprentissage non supervisé des répétitions,2011,fr,4,4,4,Images,pas encore
584,Système de recherche de musique adaptable à la perception de chaque utilisateur,2011,fr,1,1,1,Apprentissage,pas encore
585,Système pour la catégorisation automatique des offres d'emploi en une typologie de fonctions,2011,fr,1,1,1,Apprentissage,pas encore
587,Treillis des concepts SKYLINES : Analyse multidimensionnelle des SKYLINES fondée sur les ensembles en accord,2011,fr,4,4,4,Apprentissage,pas encore
588,Un critère Bayésien pour évaluer la robustesse des règles de classification,2011,fr,2,2,2,Flux,pas encore
589,Un cycle de vie complet pour l'enrichissement sémantique des folksonomies,2011,fr,3,3,3,Apprentissage,pas encore
590,Un outil de géolocalisation et de résumé automatique pour faciliter l'accès à l'information dans des corpus d'actualité,2011,fr,4,4,4,Apprentissage,pas encore
591,Un outil de navigation dans un espace sémantique,2011,fr,4,4,4,Apprentissage,pas encore
592,Un système cellulaire neuro-symbolique pour l'extraction et la gestion des connaissances,2011,fr,3,3,3,Règles,pas encore
593,Une Approche à Base de Règles Floues pour les Requêtes à Préférences Contextuelles,2011,fr,3,3,3,Apprentissage,pas encore
594,Une mesure de distance dans l'espace des alignements entre parties potentiellement homologues de deux ontologies légères,2011,fr,3,3,3,Ontologies,pas encore
595,Une méthodologie de recommandations produits fondée sur l'actionnabilité et l'intérêt économique des clients,2011,fr,4,4,4,Apprentissage,pas encore
596,Une nouvelle approche pour l'extraction non supervisée de critères,2011,fr,6,6,6,Images,pas encore
597,Une nouvelle approche visuelle pour la classification hiérarchique et topologique,2011,fr,2,2,2,Images,pas encore
598,Utilisation d'une ontologie du domaine pour la découverte du contenu de bases de données géographiques,2011,fr,4,4,4,Ontologies,pas encore
599,Utilisation de la Machine Cellulaire pour la Détection des Courriels Indésirables,2011,fr,3,3,3,Apprentissage,pas encore
600,Utiliser des résultats d'alignement pour enrichir une ontologie,2011,fr,3,3,3,Ontologies,pas encore
601,Vers la fusion d'informations hétérogènes et partielles pour l'aide au codage diagnostique,2011,fr,7,7,7,Apprentissage,pas encore
602,Visualisation de l'intra et inter structure des groupes en classification non supervisée,2011,fr,2,2,2,Images,pas encore
603,AbsTop-K &#945;: un algorithme d'extraction de paires abstraites hautement corrélées pour mieux recommander dans la ”longue traine,2010,fr,3,3,3,Règles,pas encore
605,Affichage de publicités sur des portails web,2010,fr,3,3,3,Extraction,pas encore
606,"Agrégation de systèmes de fermetures: cas des hiérarchies, topologies et géométries convexes",2010,fr,1,1,1,Apprentissage,pas encore
607,Aide à la décision pour la maintenance ferroviaire préventive,2010,fr,3,3,3,Apprentissage,pas encore
608,Allier CSPs et motifs locaux pour la découverte de motifs sous contraintes n-aires,2010,fr,3,3,3,Décisionnel,pas encore
609,Analyse de documents pédagogiques en vue de leur annotation,2010,fr,3,3,3,Visualisation,pas encore
610,Analyse de séquences d'événements avec TraMineR,2010,fr,4,4,4,Spatio-temporel,pas encore
611,Analyse en ligne d'objets complexes avec l'analyse factorielle,2010,fr,3,3,3,Apprentissage,pas encore
612,Analyse globale du flux optique pour la détection d'évènements dans une scène de foule,2010,fr,4,4,4,Apprentissage,pas encore
613,Analyse incrémentale des usages pour le routage des requêtes dans les systèmes pairs à pairs,2010,fr,2,2,2,Apprentissage,pas encore
615,Apport de la technique de fouille de données spatiales dans la prédiction des risques engendrés par les changements climatiques,2010,fr,3,3,3,Motifs,pas encore
616,Apprentissage de patrons lexico-syntaxiques à partir de textes,2010,fr,2,2,2,Apprentissage,pas encore
617,Apprentissage de spécifications de CSP,2010,fr,2,2,2,Apprentissage,pas encore
618,Apprentissage supervisé adaptatif de Concepts Formels à partir des données nominales,2010,fr,2,2,2,Motifs,pas encore
619,Approche biomimétique coopérative pour la visualisation de grands graphes multidimensionels,2010,fr,2,2,2,Apprentissage,pas encore
620,Approche complexe de l'analyse de documents anciens,2010,fr,4,4,4,Visualisation,pas encore
621,Approche Sémantique pour la Préservation de la Vie Privée dans les Médias Sociaux,2010,fr,3,3,3,Apprentissage,pas encore
622,"Bien cube, les données textuelles peuvent s'agréger !",2010,fr,5,5,5,Motifs,pas encore
623,Caractériser la terminologie des usagers de santé dans le domaine du cancer du sein,2010,fr,4,4,4,Apprentissage,pas encore
624,CARTOCEL : Un outil de cartographie des connaissances guidée par la machine cellulaire CASI,2010,fr,3,3,3,Règles,pas encore
625,ChorML : Résumés visuels de bases des données géographiques,2010,fr,4,4,4,Motifs,pas encore
626,"Classer, discriminer et visualiser des séquences d'événements",2010,fr,4,4,4,Spatio-temporel,pas encore
627,Classification de documents : calcul d'une distance structurelle,2010,fr,3,3,3,Visualisation,pas encore
628,Classification et Selection de caracteristique basees sur les concepts semantiques pour la recherche d'information multimedia,2010,fr,5,5,5,Images,pas encore
629,Classification supervisée pour de grands nombres de classes à prédire : une approche par co-partitionnement des variables explicatives et à expliquer,2010,fr,1,1,1,Images,pas encore
630,CND-Cube : Nouvelle représentation concise sans perte d'information d'un cube de données,2010,fr,4,4,4,Motifs,pas encore
631,Codage et classification non supervisée d'un corpus maya : extraire des contextes pour situer l'inconnu par rapport au connu,2010,fr,3,3,3,Images,pas encore
632,Combiner approche logique et numérique pour la réconciliation de données et l'alignement d'ontologies,2010,fr,1,1,1,Ontologies,pas encore
633,CombinerWeb 2.0 et Web Sémantique pour réduire les disparités d'expertise au sein de blogs d'entreprise,2010,fr,2,2,2,Extraction,pas encore
634,Comparaison de critères de pureté pour l'intégration de connaissances en clustering semi-supervisé,2010,fr,3,3,3,Règles,pas encore
635,Comparaisons structurelles de grandes bases de données par apprentissage non-supervisé,2010,fr,2,2,2,Motifs,pas encore
636,Composition de ServicesWeb Basée sur les Réseau Sociaux,2010,fr,4,4,4,Apprentissage,pas encore
637,Construction de noyaux pour l'apprentissage supervisé à partir d'arbres aléatoires,2010,fr,3,3,3,Visualisation,pas encore
639,DaFOE: une plateforme pour construire des ontologies à partir de textes et de thésaurus,2010,fr,10,10,10,Ontologies,pas encore
640,Découverte d'itemsets fréquents fermés sur architectures multicoeurs,2010,fr,4,4,4,Apprentissage,pas encore
641,Découverte des dépendances fonctionnelles conditionnelles fréquentes,2010,fr,2,2,2,Apprentissage,pas encore
644,Détection des mouvements anormaux dans des vidéos,2010,fr,4,4,4,Apprentissage,pas encore
645,Développement de méthodes de classification basées sur l'Analyse de Concepts Formels sous la plateforme WEKA,2010,fr,4,4,4,Images,pas encore
646,Differentes variantes GMM-SMOs pour l'identification du locuteur,2010,fr,3,3,3,Apprentissage,pas encore
647,Etude comparative des langages de requêtes sémantiques pour l'extraction des liens complexes dans une base de connaissances,2010,fr,2,2,2,Règles,pas encore
648,Etude de stabilité de méthodes de sélection de motifs à partir des séquences protéiques,2010,fr,4,4,4,Spatio-temporel,pas encore
649,Expansion de requêtes SQL par une ontologie de domaine,2010,fr,2,2,2,Ontologies,pas encore
650,Explication de décisions de réconciliation : approche fondée sur les réseaux de Petri colorés,2010,fr,3,3,3,Apprentissage,pas encore
651,Exploration de dépendances fonctionnelles et de règles d'association avec OLAP,2010,fr,2,2,2,Flux,pas encore
652,Extraction d'itemsets distinctifs dans les flux de données,2010,fr,2,2,2,Motifs,pas encore
653,Extraction de la région d'intérêt d'une personne sur un obstacle,2010,fr,4,4,4,Règles,pas encore
655,Extraction de règles d'association séquentielle à l'aide de modèles semi-paramétriques à risques proportionnels,2010,fr,4,4,4,Flux,pas encore
656,Extraction des séquences fermées fréquentes à partir de corpus parallèles : Application à la traduction automatique,2010,fr,4,4,4,Spatio-temporel,pas encore
657,Fouille visuelle de données en 3D et réalité virtuelle : état de l'art,2010,fr,3,3,3,Motifs,pas encore
658,Gestion sémantique des droits d'accès au contenu: l'ontologie AMO,2010,fr,3,3,3,Ontologies,pas encore
660,IncFDs: un nouvel algorithme d'inférence incrémentale des dépendances fonctionnelles,2010,fr,1,1,1,Apprentissage,pas encore
661,Indexation et recherche d'images à très grande échelle avec une AFC incrémentale et parallèle sur GPU,2010,fr,4,4,4,Apprentissage,pas encore
662,Indice de complexité pour le tri et la comparaison de séquences catégorielles,2010,fr,4,4,4,Spatio-temporel,pas encore
663,Inférence Bayesienne du Maximum d'Entropie pour le Diagnostic du Cancer,2010,fr,2,2,2,Apprentissage,pas encore
664,Intégration de Connaissances a Priori dans le Principe du Maximum d'Entropie,2010,fr,2,2,2,Règles,pas encore
665,Intégration interactive de contraintes pour la réduction de dimensions et la visualisation,2010,fr,4,4,4,Apprentissage,pas encore
666,Interrogation des résumés de flux de données,2010,fr,3,3,3,Motifs,pas encore
667,K-WORDS LAB : un outil d'analyse des mots clés permettant d'explorer les dynamiques d'un domaine scientifique.,2010,fr,2,2,2,Apprentissage,pas encore
668,KGRAM: une machine abstraite de graphes de connaissance,2010,fr,2,2,2,Règles,pas encore
669,Le conflit dans la théorie des fonctions de croyance,2010,fr,1,1,1,Apprentissage,pas encore
670,Modèle de Langue à base de Concepts pour la Recherche d'Information,2010,fr,2,2,2,Apprentissage,pas encore
671,Modélisation et interrogation de données XML multidimensionnelles,2010,fr,3,3,3,Motifs,pas encore
674,OSOM : un algorithme de construction de cartes topologiques recouvrantes,2010,fr,1,1,1,Apprentissage,pas encore
676,PCAR : Nouvelle Approche de Génération de Règles d'Association Cycliques,2010,fr,2,2,2,Flux,pas encore
677,PGP-mc : extraction parallèle efficace de motifs graduels,2010,fr,4,4,4,Décisionnel,pas encore
678,Prédiction de séries temporelles et applications à l'analyse de séquences vidéo,2010,fr,4,4,4,Spatio-temporel,pas encore
679,PretopoLib: la librairie JAVA de la Prétopologie,2010,fr,2,2,2,Apprentissage,pas encore
680,Proposition d'opérateurs OLAP pour un modèle multidimensionnel à base d'objets complexes,2010,fr,2,2,2,Apprentissage,pas encore
681,Proposition d'une méthode de classification associative adaptative,2010,fr,2,2,2,Images,pas encore
684,Recherche sémantique sur le Web basée sur l'ontologie Modulaire et le raisonnement à base de cas,2010,fr,4,4,4,Extraction,pas encore
685,Reconnaissance de concepts basée sur l'apprentissage,2010,fr,2,2,2,Apprentissage,pas encore
686,Réduction bi-directionnelle d'images - Vers une méthode d'extraction de caractéristiques multi-niveaux,2010,fr,1,1,1,Règles,pas encore
687,REGLO : une nouvelle stratégie pour résumer un flux de séries temporelles,2010,fr,3,3,3,Spatio-temporel,pas encore
688,Regrouper les données textuelles et nommer les groupes à l'aide de classes recouvrantes,2010,fr,3,3,3,Motifs,pas encore
689,Requêtes skyline avec prise en compte des préférences utilisateurs pour des données volumineuses,2010,fr,4,4,4,Motifs,pas encore
690,Résumé généraliste de flux de données,2010,fr,2,2,2,Motifs,pas encore
692,SALINES : un automate au service de l'extraction de motifs séquentiels multidimensionnels,2010,fr,5,5,5,Décisionnel,pas encore
693,Sélection par entropie de descripteurs textuels pour la catégorisation de documents,2010,fr,2,2,2,Visualisation,pas encore
695,SequencesViewer : comment rendre accessible des motifs séquentiels de gènes trop nombreux,2010,fr,5,5,5,Décisionnel,pas encore
696,SIAM: Système d'Indexation des Articles Médicaux,2010,fr,3,3,3,Apprentissage,pas encore
697,Simplification de données de vol pour un stockage optimal et une visualisation accélérée,2010,fr,4,4,4,Motifs,pas encore
699,SoTree : Auto-organisation topologique et hiérarchique des données,2010,fr,2,2,2,Motifs,pas encore
700,Sous-échantillonnage topographique par apprentissage semi-supervisé,2010,fr,2,2,2,Apprentissage,pas encore
701,Suivi d'Automobiles par Classification Hiérarchique Ascendante,2010,fr,3,3,3,Images,pas encore
702,Système d'extraction des connaissances à partir des données temporelles basé sur les Réseaux Bayésiens Dynamiques,2010,fr,3,3,3,Règles,pas encore
